label,text,fullname,replies,retweet,likes
REAL,চুল কালো করুন ঘরোয়া ৪ উপায়  ,,,,
REAL,চুলের যত্নে ডিম কেন ব্যবহার করবেন ও কীভাবে ঘরোয়া উপায়  ,,,,
FAKE,পেট থেকে গ্যাস দূর করার যাদুকরি ঘরোয়া উপায়  ,,,,
REAL,কেটে গেলে রক্তপাত বন্ধের ঘরোয়া উপায়  ,,,,
REAL,"বণের/ব্রণের  সমস্যা সমাধানের ঘরোয়া উপায়
 ",,,,
REAL,"চুৃলপড়া রোধ করার ঘরোয়া উপায়
 ",,,,
REAL,"ঘরোয়া পদ্ধতিতে ঠোঁটের কালচে ভাব দূর করে লাল ঠোঁট পাওয়ার ছয়টি উপায়
 ",,,,
UNSURE,থাইরয়েডের সমস্যা নিয়ন্ত্রণে রাখার ঘরোয়া ৪টি উপায়  ,,,,
REAL,পেশি দুর্বলতা কমাতে ঘরোয়া উপায়!  ,,,,
REAL,রক্তপাত বন্ধের কিছু ঘরোয়া উপায়  ,,,,
IRRELEVANT,মশা তাড়ানোর সহজ উপায়/ মশা মারার ঘরোয়া উপায়/ মশা তাড়ানোর উপায়   via @YouTube,,,,
FAKE,মাত্র ১ রাতে পা ফাটা দূর করার জন্য সব থেকে সহজ উপায় || পা ফাটার ১০০ % কার্যকরী ঘরোয়া চিকিৎসা  ,,,,
REAL,ঘরোয়া ভাবে ঠান্ডা কাশি দূর করার উপায়   via @YouTube,,,,
REAL,ঠোঁটের কালচে ভাব দূর করতে ৬টি সহজ ঘরোয়া উপায়  ,,,,
UNSURE,মাত্র ১৫ দিনে ওজন কমানোর ১২ টি সহজ ঘরোয়া উপায় জেনে নিন  ,,,,
REAL,মুঠো মুঠো চুল পড়া বন্ধ করার ঘরোয়া ৭টি উপায় জেনে নিন  ,,,,
REAL,ঘরোয়া পদ্ধতিতে পায়ের গোড়ালি ফাটা দূর করার উপায় ।bangla beauty tips  via @YouTube,,,,
REAL,মুখের ভেতরে ঘা হওয়ার কিছু কারণ ও তা থেকে মুক্তির ঘরোয়া উপায়  ,,,,
REAL,অনিয়মিত পিরিয়ডকে সহজেই নিয়মিত করার ঘরোয়া উপায় জানুন  ,,,,
REAL,পেশির ব্যথা নিরাময়ে চার ঘরোয়া উপায় | কালের কণ্ঠ  ,,,,
REAL,"ব্ল্যাকহেডস কি আপনাকে খুব বিব্রত করছে? জেনে নিন তা দূর করার ঘরোয়া উপায়
 ",,,,
REAL,দাঁত ব্যথা কমানোর ঘরোয়া উপায়  ,,,,
REAL,পাকা চুল কালো করার ঘরোয়া উপায়।  ,,,,
REAL,সাইনাস কমাতে ঘরোয়া উপায়  ,,,,
REAL,পিঠের ব্যথায় ভুগছেন? ঘরোয়া উপায়ে ব্যথামুক্তির উপায়  ,,,,
UNSURE,"জেনে নিন যৌন দুর্বলতা দূর করার ঘরোয়া উপায়
কখনো ভেবে দেখেছেন কি আপনার নিত্যদিনের ব্যস্ত লাইফস্টাইল আপনার যৌন জীবনের কতটা ক্ষতি করছে? জাঙ্ক ফুড থেকে আমাদের শরীরে-ত্বকে প্রচুর পরিমাণে ক্যালরি ক্ষয় হচ্ছে। ",,,,
REAL,জেনে নিন পা ব্যথা দূর করার ঘরোয়া কিছু উপায়  ,,,,
FAKE,"স্কিন এলার্জি থেকে মুক্তি পাওয়ার ঘরোয়া উপায় কবিরাজি চিকিৎসা অ্যালার্জি Skin Allergy Home Remedies  

#skinallergy #homeremedies #skinallergyhomeremedies #allergysymptoms #allergies #allergicreaction #allergykailaj #allergy #allergykidawai ",,,,
REAL,ডার্ক সার্কেল দূর করার ঘরোয়া উপায়  ,,,,
IRRELEVANT,ফরমালিন দূর করার ঘরোয়া উপায়  ,,,,
REAL,শীতে ত্বকের যত্নে ঘরোয়া সহজ উপায়  ,,,,
REAL,"বদহজম, গ্যাস, পেট ফোলা, এসিড হবার প্রধান কারণ ও তা থেকে মুক্তি পাবার সহজ ঘরোয়া উপায়  ",,,,
REAL,হাত পা উজ্জ্বল রাখার ঘরোয়া উপায়  ,,,,
REAL,মেছতার বিরক্তিকর বিশ্রী দাগ থেকে মুক্তি পাবার ঘরোয়া ৯ উপায়  ,,,,
REAL,খুসকির সমস্যা দূর করতে ৫ ঘরোয়া উপায়  ,,,,
REAL,ঘরোয়া পদ্ধতিতে গ্যাস্ট্রিকের ব্যথা দূর করার উপায়  ,,,,
REAL,"কোষ্টকাঠিন্য দূর করার ৪ টি ঘরোয়া উপায় পেট পরিষ্কার পায়খানা নরম করার উপায় Constipation Home Remedies

#constipation #constipationhomeremedies #homeremedies #constipationrelief #constipationremedies #paikhanaclear #paikhana #kabjkailaj ",,,,
REAL,"আমাদের হাতের কাছেই রয়েছে কিছু ঘরোয়া উপায়, যার মাধ্যমে কোনওরকম পার্শ্বপ্রতিক্রিয়া ছাড়াই মুক্তি পেতে পারেন ব্রণর হাত থেকে।  ",,,,
REAL,খুশকি দু ধরনের-শুষ্ক ও তৈলাক্ত । কিছু ঘরোয়া উপায় সহজেই খুশকির মোকাবিলা করতে পারেন-............বিস্তারিত পড়তে বাসাইলটাইমস২৪.কম ক্লিক করুন।  ,,,,
REAL,পায়ে ব্যথা | কারণ লক্ষণ এবং উপশমের ৬ টি ঘরোয়া উপায়  ,,,,
REAL,মেনে চলুন ঘরোয়া এই চারটি উপায়  ,,,,
FAKE,"টাইফয়েড জ্বর কি মাত্র ১০ দিনে টাইফয়েড থেকে মুক্তি পাওয়ার ঘরোয়া উপায় চিকিৎসা Typhoid Fever Treatment

#typhoidfever #typhoidtreatment #typhoid #typhoidsymptoms #symptomsoftyphoid #fever #typhoidmedicine #typhoidkailaj #typhoidfeverhomeremedies ",,,,
REAL,স্ট্রেচ মার্কস নিয়ে চিন্তিত জেনে নিন ৫ ঘরোয়া উপায়!‍  ,,,,
REAL,চুল ঘন কলো করার ঘরোয়া প্রাকৃতিক উপায়  ,,,,
UNSURE,এসময় ভুল করে কানে আঙুল বা কটন বাড ঢুকিয়ে আরাম পাবার চেষ্টা করবেন না। এসময় বরং কিছু ঘরোয়া উপায় অবলম্বন করা যায়।............বিস্তারিত পড়তে বাসাইলটাইমস২৪.কম ক্লিক করুন।  ,,,,
REAL,ঘরোয়া উপায়ে প্রাকৃতিক ভাবে চুল পড়া বন্ধের ১০ উপায়  ,,,,
REAL,আন্ডারআর্ম বা বগলের নিচে কালো দাগের কারণ ও মুক্তির ঘরোয়া উপায়  ,,,,
REAL,ব্ল্যাকহেডস সহজে দূর করার ১৩ টি ঘরোয়া উপায়  ,,,,
REAL,"মুখের তেলতেলে ভাব দূর করুন মাত্র ১০ মিনিটে। মুখের তৈলাক্ত ত্বক ফর্সা ও উজ্জ্বল করার ৬ টি ঘরোয়া উপায়
#oilyskin #oilyskincare #skincareroutine #oilyskincareroutine #skincare #howtogetridofoilyskin #pimples #stopoilyskin
 ",,,,
REAL,খুশকি দূর করার ঘরোয়া ৬ উপায়  ,,,,
FAKE,মাত্র ২৪ ঘন্টায় লিভার পরিষ্কার ও ভালো করার প্রাকৃতিক উপায় ঘরোয়া উপায় Liver Detox Liver Cleanse  ,,,,
IRRELEVANT,Iron করার ঘরোয়া উপায়   via @YouTube,,,,
REAL,"কষা পায়খানা নরম করার উপায় কোষ্টকাঠিন্য দূর করার ৮ টি সহজ ঘরোয়া উপায়  Home Remedies For Constipation

#constipation #homeremedies #homeremediesforconstipation #constipationhomeremedies #constipationremedies #kabjkailaj #petsaafkarnekeupay ",,,,
REAL,৪ টি ঘরোয়া পদ্ধতিতে মাত্র ৫ মিনিটে দাঁত ঝকঝকে করার উপায়। Bangla Health Tips.   via @YouTube,,,,
REAL,গ্যাস ঠেকানোর ১৪টি ঘরোয়া উপায় জেনে নিন  ,,,,
REAL,চোখের ফোলা ভাব দূর করার কিছু সহজ ঘরোয়া উপায়  ,,,,
REAL,নখের হলদে ভাব দূর করার ঘরোয়া ৫টি উপায়  ,,,,
REAL,জেনে নিন বুকে জমে থাকা কফ দূর করার অসাধারণ ঘরোয়া উপায়   via @Nagorik2,,,,
FAKE,কীভাবে যৌ-শক্তি বাড়াবেন ? এখনই জেনে নিন যৌ-শক্তি বাড়ানোর ঘরোয়া উপায়  ,,,,
IRRELEVANT,বাড়িতে লুকিয়ে থাকা মাকড়সাদের জব্দ করার ঘরোয়া উপায়  ,,,,
REAL,টনসিল এর ব্যথা সারানোর ঘরোয়া উপায়  ,,,,
IRRELEVANT,chana/curd cheese recipe | perfect ছানা তৈরী করার ঘরোয়া উপায়:   via,,,,
REAL,"Skin Freshening কি ও কেন ? ঘরোয়া উপায় স্কিন ফ্রেশনিং কিভাবে করবেন ? DIY Skin Freshening Tips  

#skinfreshening #skinfresheningtips #diy #doityourself #beautytips #skincare #glowingskin #clearskin #skincareroutine #banglahealthtipslive #skinwhitening ",,,,
REAL,দাড়ি গজানোর ঘরোয়া উপায় ।।,,,,
REAL,শরীরের ফেটে যাওয়া দাগ সারানোর ৫টি ঘরোয়া উপায় শিখুন  ,,,,
REAL,পাকা চুল কালো করার ঘরোয়া উপায়  ,,,,
REAL,মেয়েদের অনিয়মিত মাসিকের কারণ ও করণীয় । নিয়মিত করার ঘরোয়া উপায়   via @YouTube,,,,
FAKE,১৫ দিনে ওজন কমানোর ঘরোয়া উপায় | 15 dine ojon komanor upay  ,,,,
REAL,জেনে নিন বুকে বসে যাওয়া কফ দূর করার ঘরোয়া উপায় - Bangla Health Tips | Fusion Care  ,,,,
REAL,এলার্জি থেকে বাঁচার ঘরোয়া উপায়  ,,,,
REAL,জেনে নিন গ্যাস্ট্রিক সমস্যা সমাধানের কিছু সহজ এবং কার্যকরী ঘরোয়া উপায়  ,,,,
REAL,মুখের কালো দাগ দূর করার ঘরোয়া উপায় || mukher kalo dag dur korar ghoroa upay:,,,,
REAL,কোষ্ঠকাঠিন্য দূর করার ঘরোয়া কার্যকরী উপায় দেখুন. . .  ,,,,
IRRELEVANT,রূপার গয়না উজ্জ্বল রাখার ঘরোয়া উপায়  ,,,,
REAL,নাক ডাকা বন্ধ করার সহজ ও ঘরোয়া কিছু উপায় | BD Health  ,,,,
IRRELEVANT,পিঁপড়া তাড়ানোর ঘরোয়া উপায়  ,,,,
REAL,এমন বিপদ ঘটলে গলাকে কাঁটার হাত থেকে বাঁচাতে সাধারণত ঘরোয়া কিছু উপায় রয়েছে....বিস্তারিত  ,,,,
REAL,"স্বাস্থ্য নিষয়ক ----------31-01-2019

মাইগ্রেনের ব্যথা নিয়ন্ত্রণের ঘরোয়া উপায় 

Health- Education and Politics : Domestic way to control migraine pain  ",,,,
REAL,খুব বেশী কফ জমে থাকার কারণে শ্বাসকষ্টও দেখা দেয়। তাই বুকে জমে থাকা এই কফ দূর করার জন্য রয়েছে কিছু অসাধারণ ঘরোয়া উপায়।  ,,,,
REAL,স্মৃতিশক্তি বাড়ানোর ঘরোয়া ২ উপায় || Domestic way to increase memory  ,,,,
IRRELEVANT,মাছের ফর্মালিন দূর করার ঘরোয়া উপায়  ,,,,
REAL,ঘরোয়া উপায় দূর করুন অ্যাসিডিটি  ,,,,
REAL,"দাঁতের ব্যথা দূর করার ঘরোয়া উপায় ও হোমিওপ্যাথিক চিকিৎসাঃ

যখন দাঁতের কেন্দ্রীয় অংশে যা পাল্প নামে পরিচিত সেখানে যন্ত্রণা ও প্রদাহ হয় তখনই দাঁত ব্যথা মারাত্মক আকার ধারণ করে। বিভিন্ন স্নায়ুর শেষ প্রান্ত নিহিত থাকে  ",,,,
REAL,হতাশা দূর করার ঘরোয়া উপায়  ,,,,
REAL,"মাত্র ১ মাসে গ্যাস্ট্রিক আলসার থেকে মুক্তির ঘরোয়া উপায় Gastric Stomach Peptic Ulcer Home Remedies

#gastric #stomach #pepticulcer #homeremedies #gastricproblemsolution #gastricproblem #gasproblem #gasproblemsolution #homeremediesforgastricproblem ",,,,
REAL,টানা ৩ দিন ব্যবহারে সাদা চুল ইচ্ছেমত অন্ধকার কালো করার ঘরোয়া উপায়   via @YouTube,,,,
REAL,10 বিউটি টিপস- সৌন্দর্য্য বাড়ানোর কিছু সহজ ঘরোয়া উপায়  ,,,,
REAL,দাদ হাজা চুলকানি রোগ থেকে মুক্তির ঘরোয়া উপায়   via @YouTube,,,,
REAL,অল্প বয়সে চুল পাকা বন্ধ করার ৫টি ঘরোয়া উপায়   via @YouTube,,,,
REAL,চুলের অকালপক্কতা রোধে ঘরোয়া কিছু উপায়  ,,,,
REAL,অ্যাসিডিটি দূর করার ঘরোয়া উপায়,,,,
REAL,বগলের দাগ দূর করার ঘরোয়া উপায়  ,,,,
REAL,"আদা দিয়ে মাত্র ১০ দিনে চুল কে দ্রুত লম্বা ও ঘন কালো করার ঘরোয়া উপায় । via @YouTube
#Ginger for Hair Growth
#Hair_Growth",,,,
FAKE,পৌরুষত্ব বাড়ানোর ছয় ঘরোয়া উপায়  ,,,,
REAL,হাঁচি কমাতে ঘরোয়া উপায় | কালের কণ্ঠ  ,,,,
REAL,খুব সহজে বমি বমি ভাব দুর করার দারুন ঘরোয়া উপায়   via @YouTube,,,,
AD,চোখের নিচের কালো দাগ দূর করার কিছু ঘরোয়া উপায় ও প্রোডাক্ট।  ,,,,
REAL,চিকেন পক্স হলে তার থেকে মুক্তি পাওয়ার কিছু ঘরোয়া উপায় -  ,,,,
IRRELEVANT,ছারপোকা তাড়ানোর খুব সহজ পরিক্ষিত ৭টি ঘরোয়া উপায়  ,,,,
REAL,উকুনের জ্বালা থেকে মুক্তির ঘরোয়া উপায়  ,,,,
REAL,"অর্শরোগ বা পাইলস থেকে বাঁচার ঘরোয়া ৫টি উপায়, জেনে নিন  ",,,,
IRRELEVANT,খাঁটি স্বর্ণ চেনার ঘরোয়া উপায়  ,,,,
REAL,ব্রণ দূর করার পাঁচটি ঘরোয়া উপায়  ,,,,
REAL,ঘুমের মধ্যে পেশি টান সারানোর ঘরোয়া উপায়  ,,,,
REAL,বয়সের ছাপ দূর করার ঘরোয়া উপায় | Bnews21  ,,,,
REAL,আঁচিল দূর করার ৭টি কার্যকরী ঘরোয়া উপায়  ,,,,
REAL,সর্দিতে নাক বন্ধ? জেনে নিন সারানোর সহজ ঘরোয়া উপায়  ,,,,
REAL,পেট থেকে গ্যাস দূর করার ঘরোয়া উপায়  ,,,,
REAL,গ্রিন টি দিয়ে ত্বকের ব্রণ দূর করার সহজ ঘরোয়া উপায়। জেনে নিন ব্রণ ভালো কর...   via @YouTube,,,,
REAL,হাত পা কেটে গেলে রক্তপাত বন্ধের ঘরোয়া উপায় || হেলথ এপিসোড || health episode  ,,,,
REAL,"দাঁত একেবারে ঝকঝকে সাদা করে তুলতে না পারলে মনে শান্তি পাচ্ছেন না? জেনে নিন তার ঘরোয়া উপায়
 ",,,,
REAL,ঘরোয়া পদ্ধতিতে মাড়ি থেকে রক্ত পড়া রোধের উপায়  ,,,,
REAL,ত্বকের বলিরেখা সমস্যা সমাধানে সহজ ঘরোয়া উপায় -  ,,,,
REAL,কেটে গেলে রক্তপাত বন্ধের ঘরোয়া উপায়।  ,,,,
IRRELEVANT,টিকটিকি তাড়ানোর সহজ ও ঘরোয়া উপায় জেনে নিন - Bangla Health Tips | Fusion Care  ,,,,
REAL,সাইনোসাইটিস মোকাবেলায় ঘরোয়া উপায়।  ,,,,
REAL,মাইগ্রেনের ব্যথা থেকে মুক্তির ঘরোয়া উপায়।  ,,,,
REAL,নাক ডাকা বন্ধ করার সহজ ও ঘরোয়া কিছু উপায়  ,,,,
QUERY,কাশি দূর করার ৮টি কার্যকরী ঘরোয়া উপায় জানেন কি?  ,,,,
REAL,ব্ল্যাকহেডস দূর করার ঘরোয়া ৩ উপায়  ,,,,
REAL,শীতকালে মুখের ত্বক সুন্দর রাখার ঘরোয়া উপায়।  ,,,,
REAL,মাথায় নতুন চুল গজানোর দারুন এক ঘরোয়া উপায়!  ,,,,
REAL,অ্যাসিডিটি কমানোর ঘরোয়া উপায়  ,,,,
FAKE,"জেনে নিন, কিডনি পরিষ্কারের ঘরোয়া উপায়। তাও আবার মাত্র পাঁচ টাকায়।

১. পরিষ্কার পানিতে ধুয়ে নিন এক আঁটি ধনেপাতা।
২. এরপর কুচি কুচি করে কেটে একটি পাত্রে রাখুন। 
৩. পাত্রে কিছুটা পানি দিয়ে ১০ মিনিট ফুটিয়ে নিন।",,,,
REAL,"মেছতা দূর করার ঘরোয়া উপায় – today bangla news  
#মেছতা #healthtipsbangla #টিপস্ #healthtipsbangladesh",,,,
REAL,মুখের অবাঞ্ছিত লোম হওয়ার কারন ও দূর করার ঘরোয়া উপায় || টপ টিপস  ,,,,
REAL,"মশা তাড়ানোর ঘরোয়া উপায় ,যা আপনার শরীরের জন্য ক্ষতিকারক নয় -  ",,,,
REAL,মানসিক চাপ কাটানোর ঘরোয়া উপায় জেনে রাখুন  ,,,,
REAL,দাঁতের হলুদদাগ দূরীকরণে সহজ ঘরোয়া উপায়  ,,,,
REAL,ট্যাবলেট ছাড়ায় মাসিকের ব্যাথা কমানোর ঘরোয়া উপায়।মাসিকের ব্যাথা দূর করার ঘরোয়া উপায়।    ,,,,
REAL,গ্যাস্ট্রাইটিস নিয়ণ্ত্রনের ঘরোয়া উপায়।  ,,,,
FAKE,৫ টাকায় কিডনি ক্লিন! জেনে নিন ঘরোয়া উপায় | banglanewspaper  ,,,,
REAL,ঘামের দুর্গন্ধ দূর করার ঘরোয়া উপায়  ,,,,
REAL,স্ট্রেচ মার্ক বা ত্বকের ফাটা দাগ দূর করার ঘরোয়া উপায়।। টপ টিপস  ,,,,
REAL,পাইলস বা অশ্ব রোগ থেকে মুক্তি পাওয়ার ঘরোয়া উপায় জেনে নিন - Bangla Health Tips | Fusion Care  ,,,,
REAL,ঘামাচি দূর করার ঘরোয়া উপায় | Asian Times of Bangladesh:  ,,,,
REAL,চোখের নিচে কালো দাগ পড়া নিয়ে চিন্তিত? ঘরোয়া পধতিতে চোখের নিচে কালো দাগকে ঝটপট দূর করার উপায় জেনে নিন   via @রূপকাহন.কম,,,,
REAL,গরমে ঘামাচি নিরাময়ের ঘরোয়া উপায়  ,,,,
REAL,খুশকি দূর করার ঘরোয়া উপায়  ,,,,
REAL,"লিভার সুস্থ রাখতে চান,জেনেনিন লিভার সুস্থ রাখার কয়েকটি ঘরোয়া উপায় - UBG NEWS  ",,,,
REAL,কাঁধের ব্যথা? ট্রাই করুন ঘরোয়া ৪ উপায়  ,,,,
REAL,ছিঁড়ে যাওয়া রুক্ষ চুল লম্বা ও সিল্কি করার সবচেয়ে সহজ ঘরোয়া উপায় - Hair Growth  via @YouTube,,,,
REAL,জ্বর সারানোর ঘরোয়া উপায়  ,,,,
REAL,"লিভার সুস্থ রাখতে চান,জেনেনিন লিভার সুস্থ রাখার কয়েকটি ঘরোয়া উপায়  ",,,,
IRRELEVANT,কিছু ঘরোয়া উপায় জানা থাকলে রুপার জিনিসকে ঘরে বসেই চকচকে করতে পারেন............  ,,,,
REAL,ব্রন মেছতা কালো দাগ দূর করার ঘরোয়া উপায় জেনে নিন || How To Remove BlackHeads   via @YouTube,,,,
REAL,দাঁত ব্যথা কমাতে তিন ঘরোয়া উপায় | banglanewspaper  ,,,,
FAKE,৩ দিনে কালো হাত পা সাদা করার ঘরোয়া উপায়  - ১০০% গ্যারেন্টি ।   via @YouTube,,,,
REAL,ঘামের বিচ্ছিরি গন্ধ দূর করার ৫ টি চমৎকার ঘরোয়া উপায়  ,,,,
